Symbol,Name,Last Sale,Net Change,% Change,Market Cap,Country,IPO Year,Volume,Sector,Industry
INDT,INDUS Realty Trust Inc. (MD) Common Stock,$63.63,-0.20,-0.313%,648543430.00,United States,,71437,Real Estate,Real Estate Investment Trusts
INFI,Infinity Pharmaceuticals Inc. Common Stock,$0.4909,-0.0491,-9.093%,43859746.00,United States,,1757335,Health Care,Biotechnology: Pharmaceutical Preparations
INFN,Infinera Corporation Common Stock,$6.68,-0.06,-0.89%,1467888791.00,United States,2007,2811451,Utilities,Telecommunications Equipment
INGN,Inogen Inc Common Stock,$20.68,0.20,0.977%,474006321.00,United States,2014,383019,Health Care,Industrial Specialties
INKA,KludeIn I Acquisition Corp. Class A Common Stock,$10.215,0.035,0.344%,150333072.00,United States,2021,105,Industrials,Consumer Electronics/Appliances
INKAU,KludeIn I Acquisition Corp. Unit,$10.22,0.00,0.00%,0.00,United States,2021,700,Industrials,Consumer Electronics/Appliances
INKAW,KludeIn I Acquisition Corp. Warrant,$0.10,0.00,0.00%,0.00,United States,2021,34,Industrials,Consumer Electronics/Appliances
INKT,MiNK Therapeutics Inc. Common Stock,$2.27,0.06,2.715%,76694059.00,United States,2021,9629,Health Care, Medicinal Chemicals and Botanical Products 
INM,InMed Pharmaceuticals Inc. Common Shares,$1.78,-0.08,-4.301%,1934435.00,Canada,,24882,Health Care,Pharmaceuticals and Biotechnology
INMB,INmune Bio Inc. Common stock,$7.47,-0.04,-0.533%,134056583.00,United States,2019,18491,Health Care,Biotechnology: Pharmaceutical Preparations
INMD,InMode Ltd. Ordinary Shares,$36.33,0.07,0.193%,3018335636.00,Israel,2019,608758,Health Care,Biotechnology: Electromedical & Electrotherapeutic Apparatus
INNV,InnovAge Holding Corp. Common Stock,$6.78,-0.15,-2.165%,919164654.00,United States,2021,151657,Health Care,Hospital/Nursing Management
INO,Inovio Pharmaceuticals Inc. Common Stock,$1.80,0.04,2.273%,449080675.00,United States,,8794343,Health Care,Biotechnology: Biological Products (No Diagnostic Substances)
INOD,Innodata Inc. Common Stock,$2.90,0.01,0.346%,79396879.00,United States,1993,40875,Technology,EDP Services
INPX,Inpixon Common Stock,$1.80,-0.03,-1.639%,5830007.00,United States,2014,26661,Technology,Computer Software: Prepackaged Software
INSE,Inspired Entertainment Inc. Common Stock,$12.50,0.21,1.709%,323339963.00,United States,2014,209352,Technology,EDP Peripherals
INSG,Inseego Corp. Common Stock,$0.90,-0.0501,-5.273%,97064699.00,United States,,3880124,Telecommunications,Telecommunications Equipment
INSM,Insmed Incorporated Common Stock,$19.10,-0.36,-1.85%,2587607052.00,United States,,4242389,Health Care,Biotechnology: Pharmaceutical Preparations
INTA,Intapp Inc. Common Stock,$24.39,0.06,0.247%,1536646365.00,United States,2021,229378,Technology,Computer Software: Prepackaged Software
INTC,Intel Corporation Common Stock,$26.92,-0.23,-0.847%,111098840000.00,United States,,80609166,Technology,Semiconductors
INTE,Integral Acquisition Corporation 1 Class A Common Stock,$10.04,0.00,0.00%,144325000.00,United States,2021,32905,Industrials,Consumer Electronics/Appliances
INTEU,Integral Acquisition Corporation 1 Unit,$9.99,-0.08,-0.794%,0.00,United States,2021,200,Industrials,Consumer Electronics/Appliances
INTEW,Integral Acquisition Corporation 1 Warrants,$0.0745,0.00,0.00%,0.00,United States,2021,50,Industrials,Consumer Electronics/Appliances
INTG,Intergroup Corporation (The) Common Stock,$48.52,-2.43,-4.769%,107588927.00,United States,,1155,Consumer Discretionary,Hotels/Resorts
INTR,Inter & Co. Inc. Class A Common Shares,$1.81,-0.03,-1.63%,726098769.00,Brazil,,363712,,
INTU,Intuit Inc. Common Stock,$384.98,-11.55,-2.913%,108150641243.00,United States,1993,3545969,Technology,Computer Software: Prepackaged Software
INTZ,Intrusion Inc. Common Stock,$3.24,-0.21,-6.087%,68513740.00,United States,,18326,Technology,Security Systems Services
INVA,Innoviva Inc. Common Stock,$12.77,-0.19,-1.466%,891131272.00,United States,2004,1875819,Health Care,Biotechnology: Pharmaceutical Preparations
INVE,Identiv Inc. Common Stock,$7.12,-0.20,-2.732%,160293478.00,United States,,111129,Technology,Computer peripheral equipment
INVO,INVO BioScience Inc. Common Stock,$0.47,0.04,9.302%,5718003.00,United States,,72211,Health Care,Medical/Dental Instruments
INVZ,Innoviz Technologies Ltd. Ordinary shares,$4.34,-0.07,-1.587%,589413512.00,Israel,,1037276,Consumer Discretionary,Auto Parts:O.E.M.
INVZW,Innoviz Technologies Ltd. Warrant,$1.3501,-0.1498,-9.987%,0.00,Israel,,3456,Consumer Discretionary,Auto Parts:O.E.M.
INZY,Inozyme Pharma Inc. Common Stock,$1.35,-0.04,-2.878%,54532390.00,United States,2020,72671,Health Care,Biotechnology: Pharmaceutical Preparations
IOAC,Innovative International Acquisition Corp. Class A Ordinary Shares,$10.26,-0.01,-0.097%,329448600.00,United States,2022,6778,Finance,Business Services
IOACU,Innovative International Acquisition Corp. Unit,$10.22,0.00,0.00%,0.00,United States,2021,2,Finance,Business Services
IOACW,Innovative International Acquisition Corp. Warrants,$0.0251,-0.0152,-37.717%,0.00,United States,2022,267,Finance,Business Services
IOBT,IO Biotech Inc. Common Stock,$2.70,-0.25,-8.475%,77801221.00,Denmark,2021,39879,Health Care,Biotechnology: Pharmaceutical Preparations
IONM,Assure Holdings Corp. Common Stock,$0.291,-0.0515,-15.036%,5536333.00,United States,,169646,Health Care,Assisted Living Services
IONR,ioneer Ltd American Depositary Shares,$13.655,0.455,3.447%,716887500.00,Australia,,2486,,
IONS,Ionis Pharmaceuticals Inc. Common Stock,$38.66,0.46,1.204%,5491665990.00,United States,,1901778,Health Care,Biotechnology: Pharmaceutical Preparations
IOSP,Innospec Inc. Common Stock,$103.06,0.19,0.185%,5104535417.00,United States,,910554,Industrials,Industrial Specialties
IOVA,Iovance Biotherapeutics Inc. Common Stock,$6.47,0.09,1.411%,1021228559.00,United States,,8805534,Health Care,Biotechnology: Pharmaceutical Preparations
IPA,ImmunoPrecise Antibodies Ltd. Common Stock,$4.91,0.01,0.204%,122433050.00,Canada,,39208,Health Care,Pharmaceuticals and Biotechnology
IPAR,Inter Parfums Inc. Common Stock,$92.37,-0.88,-0.944%,2944351481.00,United States,,241694,Consumer Discretionary,Package Goods/Cosmetics
IPAX,Inflection Point Acquisition Corp. Class A Ordinary Share,$9.94,0.00,0.00%,409714375.00,United States,2021,97389,Finance,Business Services
IPAXU,Inflection Point Acquisition Corp. Units,$10.04,-0.0298,-0.296%,0.00,United States,2021,1000,Finance,Business Services
IPAXW,Inflection Point Acquisition Corp. Warrants,$0.28,0.031,12.45%,0.00,United States,2021,700,Finance,Business Services
IPDN,Professional Diversity Network Inc. Common Stock,$0.661,0.1585,31.542%,12168535.00,United States,2013,473012,Technology,EDP Services
IPGP,IPG Photonics Corporation Common Stock,$91.47,-0.69,-0.749%,4455902418.00,United States,2006,581631,Technology,Semiconductors
IPHA,Innate Pharma S.A. ADS,$1.90,-0.30,-13.636%,152402931.00,France,2019,511799,Health Care,Biotechnology: Pharmaceutical Preparations
IPSC,Century Therapeutics Inc. Common Stock,$7.34,-0.79,-9.717%,432870973.00,United States,2021,153117,Health Care, Medicinal Chemicals and Botanical Products 
IPVI,InterPrivate IV InfraTech Partners Inc. Class A Common Stock,$10.06,-0.03,-0.297%,361531250.00,United States,2021,24480,Industrials,Consumer Electronics/Appliances
IPVIU,InterPrivate IV InfraTech Partners Inc. Units,$10.11,0.02,0.198%,0.00,United States,2021,3355,Industrials,Consumer Electronics/Appliances
IPVIW,InterPrivate IV InfraTech Partners Inc. Warrant,$0.04,0.00,0.00%,0.00,United States,2021,100231,Industrials,Consumer Electronics/Appliances
IPW,iPower Inc. Common Stock,$0.4699,0.0297,6.747%,13896062.00,United States,2021,6622,Consumer Discretionary,Catalog/Specialty Distribution
IPWR,Ideal Power Inc. Common Stock,$10.27,-0.1325,-1.274%,60631995.00,United States,2013,7957,Industrials,Industrial Machinery/Components
IPX,IperionX Limited American Depositary Share,$5.09,-0.01,-0.196%,71406841.00,United States,,165,Consumer Discretionary,Diversified Commercial Services
IQ,iQIYI Inc. American Depositary Shares,$3.75,0.06,1.626%,3229781438.00,China,2018,17123969,Technology,Internet and Information Services
IQMD,Intelligent Medicine Acquisition Corp. Class A Common Stock,$10.18,-0.015,-0.147%,263407500.00,United States,2021,22852,Industrials,Consumer Electronics/Appliances
IQMDU,Intelligent Medicine Acquisition Corp. Unit,$10.15,0.00,0.00%,262631250.00,United States,2021,34,Industrials,Consumer Electronics/Appliances
IQMDW,Intelligent Medicine Acquisition Corp. Warrant,$0.03,0.0101,50.754%,0.00,United States,2021,5202,Industrials,Consumer Electronics/Appliances
IRAA,Iris Acquisition Corp Class A Common Stock,$10.04,0.00,0.00%,346380000.00,United States,2021,7,Industrials,Consumer Electronics/Appliances
IRAAW,Iris Acquisition Corp Warrant,$0.071,0.00,0.00%,0.00,United States,2021,25,Industrials,Consumer Electronics/Appliances
IRBT,iRobot Corporation Common Stock,$47.91,0.48,1.012%,1310407490.00,United States,2005,1102878,,
IRDM,Iridium Communications Inc Common Stock,$50.33,-0.17,-0.337%,6323588787.00,United States,,2256462,Consumer Discretionary,Telecommunications Equipment
IREN,Iris Energy Limited Ordinary Shares,$1.38,0.06,4.545%,75876424.00,Australia,2021,930775,Technology,EDP Services
IRIX,IRIDEX Corporation Common Stock,$2.23,-0.02,-0.889%,35656857.00,United States,1996,35378,Health Care,Biotechnology: Electromedical & Electrotherapeutic Apparatus
IRMD,iRadimed Corporation Common Stock,$28.50,-0.09,-0.315%,358140576.00,United States,2014,98973,Health Care,Medical/Dental Instruments
IROQ,IF Bancorp Inc. Common Stock,$17.34,0.3199,1.88%,57874435.00,United States,2011,861,Finance,Finance: Consumer Services
IRTC,iRhythm Technologies Inc. Common Stock,$94.63,-0.93,-0.973%,2849392385.00,United States,2016,585200,Health Care,Medical/Dental Instruments
IRWD,Ironwood Pharmaceuticals Inc. Class A Common Stock,$12.07,0.02,0.166%,1851483407.00,United States,2010,5576190,Health Care,Biotechnology: Pharmaceutical Preparations
ISAA,Iron Spark I Inc. Class A Common Stock,$10.00,-0.04,-0.398%,220408000.00,United States,2021,48104,Industrials,Consumer Electronics/Appliances
ISEE,IVERIC bio Inc. Common Stock,$22.32,0.40,1.825%,2992504941.00,United States,2013,4012060,Health Care,Biotechnology: Pharmaceutical Preparations
ISIG,Insignia Systems Inc. Common Stock,$8.98,0.14,1.584%,16132624.00,United States,1991,19125,Consumer Discretionary,Advertising
ISO,IsoPlexis Corporation Common Stock,$0.7066,-0.0437,-5.824%,27964394.00,United States,2021,25649,Health Care,Biotechnology: Electromedical & Electrotherapeutic Apparatus
ISPC,iSpecimen Inc. Common Stock,$1.40,0.00,0.00%,12265401.00,United States,2021,17178,Health Care,Precision Instruments
ISPO,Inspirato Incorporated Class A Common Stock,$1.41,-0.11,-7.237%,73955164.00,United States,2021,255712,Consumer Discretionary,Hotels/Resorts
ISPOW,Inspirato Incorporated Warrant,$0.10,-0.009,-8.257%,0.00,United States,2021,9297,Consumer Discretionary,Hotels/Resorts
ISRG,Intuitive Surgical Inc. Common Stock,$264.68,-2.62,-0.98%,93533827988.00,United States,2000,5247569,Health Care,Medical/Dental Instruments
ISSC,Innovative Solutions and Support Inc. Common Stock,$8.33,-0.06,-0.715%,143910854.00,United States,2000,67087,Industrials,Military/Government/Technical
ISTR,Investar Holding Corporation Common Stock,$21.52,-0.13,-0.60%,212851738.00,United States,2014,10920,Finance,Commercial Banks
ISUN,iSun Inc. Common Stock,$1.36,0.01,0.741%,20009273.00,United States,2016,26436,Technology,Semiconductors
ITAQ,Industrial Tech Acquisitions II Inc. Class A Common Stock,$10.13,0.01,0.099%,218428125.00,United States,2022,10019,Industrials,Consumer Electronics/Appliances
ITAQW,Industrial Tech Acquisitions II Inc. Warrants,$0.125,0.025,25.00%,0.00,United States,2022,7670,Industrials,Consumer Electronics/Appliances
ITCI,Intra-Cellular Therapies Inc. Common Stock,$51.05,-0.78,-1.505%,4834693007.00,United States,,806969,Health Care,Biotechnology: Pharmaceutical Preparations
ITI,Iteris Inc. Common Stock,$2.79,-0.02,-0.712%,118963148.00,United States,,42922,Telecommunications,Telecommunications Equipment
ITIC,Investors Title Company Common Stock,$142.30,2.46,1.759%,269940539.00,United States,,10795,Finance,Specialty Insurers
ITOS,iTeos Therapeutics Inc. Common Stock,$21.16,-0.31,-1.444%,752773835.00,United States,2020,1623902,Health Care, Medicinal Chemicals and Botanical Products 
ITQ,Itiquira Acquisition Corp. Class A Ordinary Shares,$10.0675,-0.0025,-0.025%,289440625.00,United States,2021,1085036,Finance,Business Services
ITQRU,Itiquira Acquisition Corp. Unit,$10.05,-0.05,-0.495%,0.00,United States,2021,1006,Finance,Business Services
ITQRW,Itiquira Acquisition Corp. Warrant,$0.0135,-0.0123,-47.674%,0.00,United States,2021,26705,Finance,Business Services
ITRI,Itron Inc. Common Stock,$49.75,-1.65,-3.21%,2247605152.00,United States,1993,975640,Industrials,Electrical Products
ITRM,Iterum Therapeutics plc Ordinary Share,$1.09,-0.12,-9.917%,13334378.00,Ireland,2018,572000,Health Care,Biotechnology: Pharmaceutical Preparations
ITRN,Ituran Location and Control Ltd. Ordinary Shares,$21.91,-0.26,-1.173%,444054987.00,Israel,2005,67770,Technology,Electronic Components
IVA,Inventiva S.A. American Depository Shares,$4.175,0.105,2.58%,175910156.00,France,2020,5376,Consumer Discretionary,Other Consumer Services
IVAC,Intevac Inc. Common Stock,$6.25,0.10,1.626%,159004100.00,United States,1995,60795,Technology,Industrial Machinery/Components
IVCA,Investcorp India Acquisition Corp. Class A Ordinary Share,$10.29,0.01,0.097%,332817188.00,Cayman Islands,2022,315,Finance,Business Services
IVCAU,Investcorp India Acquisition Corp. Unit,$10.26,0.00,0.00%,0.00,Cayman Islands,2022,100,Finance,Business Services
IVCAW,Investcorp India Acquisition Corp. Warrant,$0.0865,-0.0133,-13.327%,0.00,Cayman Islands,2022,7260,Finance,Business Services
IVCB,Investcorp Europe Acquisition Corp I Class A Ordinary Shares,$10.27,0.00,0.00%,442893750.00,Cayman Islands,2022,57,Finance,Business Services
IVCBU,Investcorp Europe Acquisition Corp I Unit,$10.40,0.00,0.00%,0.00,Cayman Islands,2021,46,Finance,Business Services
IVCBW,Investcorp Europe Acquisition Corp I Warrant,$0.019,-0.0019,-9.091%,0.00,Cayman Islands,2022,33773,Finance,Business Services
IVCP,Swiftmerge Acquisition Corp. Class A Ordinary Share,$10.11,-0.01,-0.099%,284343750.00,United States,2022,508,Finance,Business Services
IVCPU,Swiftmerge Acquisition Corp. Unit,$10.11,0.00,0.00%,0.00,United States,2021,2000,Finance,Business Services
IVCPW,Swiftmerge Acquisition Corp. Warrants,$0.04,-0.01,-20.00%,0.00,United States,2022,566,Finance,Business Services
IVDA,Iveda Solutions Inc. Common Stock,$0.64,-0.2188,-25.477%,9578713.00,United States,,3838450,Technology,Security Systems Services
IVDAW,Iveda Solutions Inc. Warrant,$0.20,0.00,0.00%,0.00,United States,,1050,Technology,Security Systems Services
IVVD,Invivyd Inc. Common Stock,$1.62,0.01,0.621%,176551490.00,United States,2021,1147568,Health Care,Biotechnology: Pharmaceutical Preparations
IXAQ,IX Acquisition Corp. Class A Ordinary Share,$10.11,0.03,0.298%,290662500.00,United Kingdom,2021,2106,Finance,Business Services
IXAQW,IX Acquisition Corp. Warrant,$0.02,0.00,0.00%,0.00,United Kingdom,2021,1,Finance,Business Services
IXHL,Incannex Healthcare Limited American Depositary Shares,$3.255,-0.1123,-3.335%,198371896.00,Australia,,1765,,
IZEA,IZEA Worldwide Inc. Common Stock,$0.6501,0.0001,0.015%,40517538.00,United States,,183675,Consumer Discretionary,Advertising
JACK,Jack In The Box Inc. Common Stock,$69.18,-0.15,-0.216%,1437710728.00,United States,,662217,Consumer Discretionary,Restaurants
JAGX,Jaguar Health Inc. Common Stock,$0.1055,-0.0024,-2.224%,15954456.00,United States,2015,3556188,Health Care,Biotechnology: Pharmaceutical Preparations
JAKK,JAKKS Pacific Inc. Common Stock,$17.08,-0.26,-1.499%,166077961.00,United States,1996,54607,Consumer Discretionary,Recreational Games/Products/Toys
JAMF,Jamf Holding Corp. Common Stock,$22.84,0.29,1.286%,2772486777.00,United States,2020,524738,Technology,Computer Software: Prepackaged Software
JAN,JanOne Inc. Common Stock (NV),$1.86,-0.20,-9.709%,5859428.00,United States,,29551,Utilities,Environmental Services
JANX,Janux Therapeutics Inc. Common Stock,$12.45,-0.25,-1.969%,518704711.00,United States,2021,484269,Health Care,Biotechnology: Pharmaceutical Preparations
JAQC,Jupiter Acquisition Corporation Common stock,$9.83,-0.03,-0.304%,199524907.00,United States,2021,18934,Industrials,Consumer Electronics/Appliances
JAQCU,Jupiter Acquisition Corporation Units,$9.94,0.00,0.00%,0.00,United States,2021,5,Industrials,Consumer Electronics/Appliances
JAZZ,Jazz Pharmaceuticals plc Common Stock (Ireland),$157.72,4.76,3.112%,9931047990.00,Ireland,2007,2626471,Health Care,Biotechnology: Pharmaceutical Preparations
JBHT,J.B. Hunt Transport Services Inc. Common Stock,$178.65,-2.72,-1.50%,18496960619.00,United States,,1118040,Industrials,Trucking Freight/Courier Services
JBLU,JetBlue Airways Corporation Common Stock,$6.84,0.09,1.333%,2215322880.00,United States,2002,12275906,Consumer Discretionary,Air Freight/Delivery Services
JBSS,John B. Sanfilippo & Son Inc. Common Stock,$80.76,0.02,0.025%,930911233.00,United States,1991,246948,Consumer Staples,Specialty Foods
JCIC,Jack Creek Investment Corp. Class A Ordinary Shares,$10.07,0.00,0.00%,434268750.00,United States,2021,9,Finance,Business Services
JCICU,Jack Creek Investment Corp. Units,$10.15,-0.01,-0.098%,0.00,United States,2021,380,Finance,Business Services
JCICW,Jack Creek Investment Corp. Warrants,$0.2206,0.0006,0.273%,0.00,United States,2021,25575,Finance,Business Services
JCSE,JE Cleantech Holdings Limited Ordinary Shares,$0.85,-0.0228,-2.612%,12767000.00,Singapore,2022,13943,Consumer Discretionary,Miscellaneous manufacturing industries
JCTCF,Jewett-Cameron Trading Company Common Shares,$5.40,0.41,8.216%,18874847.00,United States,,41540,,
JD,JD.com Inc. American Depositary Shares,$56.59,-0.06,-0.106%,88591645000.00,China,2014,7509663,Consumer Discretionary,Catalog/Specialty Distribution
JEWL,Adamas One Corp. Common Stock,$3.90,-0.04,-1.015%,71436788.00,United States,2022,226464,Consumer Discretionary,Consumer Specialties
JFBR,Jeffs' Brands Ltd Ordinary Shares,$1.21,0.03,2.542%,9769803.00,Israel,2022,45753,Miscellaneous,Diversified Commercial Services
JFBRW,Jeffs' Brands Ltd Warrant,$0.164,-0.0163,-9.04%,0.00,Israel,2022,200,Miscellaneous,Diversified Commercial Services
JFIN,Jiayin Group Inc. American Depositary Shares,$2.13,0.02,0.948%,113616888.00,China,2019,10253,Finance,Finance: Consumer Services
JFU,9F Inc. American Depositary Shares,$0.1752,-0.0273,-13.481%,40686111.00,China,2019,394408,Finance,Finance: Consumer Services
JG,Aurora Mobile Limited American Depositary Shares,$0.8751,0.0052,0.598%,104009667.00,China,2018,54741,Technology,EDP Services
JGGC,Jaguar Global Growth Corporation I Class A Ordinary Shares,$10.18,0.00,0.00%,312186670.00,United States,2022,420,Finance,Business Services
JGGCR,Jaguar Global Growth Corporation I Right,$0.09,0.03,50.00%,0.00,United States,2022,100,Finance,Business Services
JGGCU,Jaguar Global Growth Corporation I Unit,$10.21,-0.04,-0.39%,0.00,United States,2022,100,Finance,Business Services
JGGCW,Jaguar Global Growth Corporation I Warrant,$0.06,0.00,0.00%,0.00,United States,2022,50,Finance,Business Services
JJSF,J & J Snack Foods Corp. Common Stock,$151.79,-0.70,-0.459%,2917560599.00,United States,1986,400077,Consumer Staples,Specialty Foods
JKHY,Jack Henry & Associates Inc. Common Stock,$177.55,-0.38,-0.214%,12952171829.00,United States,1985,1441841,Technology,Retail: Computer Software & Peripheral Equipment
JMAC,Maxpro Capital Acquisition Corp. Class A Common Stock,$10.245,0.025,0.245%,137564994.00,Taiwan,2021,10462,Industrials,Consumer Electronics/Appliances
JMACU,Maxpro Capital Acquisition Corp. Units,$10.42,0.15,1.461%,0.00,Taiwan,2021,200,Industrials,Consumer Electronics/Appliances
JMACW,Maxpro Capital Acquisition Corp. Warrants,$0.0675,0.00,0.00%,0.00,Taiwan,2021,1215,Industrials,Consumer Electronics/Appliances
JMSB,John Marshall Bancorp Inc. Common Stock,$28.00,0.64,2.339%,394131080.00,United States,,85148,Finance,Major Banks
JNCE,Jounce Therapeutics Inc. Common Stock,$0.7489,0.0381,5.36%,38713814.00,United States,2017,1537609,Health Care,Biotechnology: Pharmaceutical Preparations
JOAN,JOANN Inc. Common Stock,$3.33,-0.30,-8.264%,135820687.00,United States,2021,292273,Consumer Discretionary,Department/Specialty Retail Stores
JOUT,Johnson Outdoors Inc. Class A Common Stock,$65.54,-0.11,-0.168%,668069406.00,United States,,101873,Consumer Discretionary,Recreational Games/Products/Toys
JRSH,Jerash Holdings (US) Inc. Common Stock,$4.37,0.09,2.103%,54164782.00,United States,2018,14964,Consumer Discretionary,Industrial Specialties
JRVR,James River Group Holdings Ltd. Common Shares,$21.75,-0.48,-2.159%,814755892.00,Bermuda,2014,571321,Finance,Property-Casualty Insurers
JSM,Navient Corporation 6% Senior Notes due December 15 2043,$18.21,-0.09,-0.492%,0.00,United States,,6629,Finance,Finance: Consumer Services
JSPR,Jasper Therapeutics Inc. Common Stock,$0.5673,-0.0763,-11.855%,21031709.00,United States,2020,74878,Health Care,Biotechnology: Pharmaceutical Preparations
JSPRW,Japer Therapeutics Inc. Warrants,$0.0483,-0.0017,-3.40%,0.00,United States,2020,14545,Health Care,Biotechnology: Pharmaceutical Preparations
JUGG,Jaws Juggernaut Acquisition Corporation Class A Ordinary Share,$10.01,-0.0025,-0.025%,345345000.00,United States,2021,292801,,
JUGGU,Jaws Juggernaut Acquisition Corporation Unit,$10.02,0.01,0.10%,0.00,United States,2021,50200,,
JUGGW,Jaws Juggernaut Acquisition Corporation Warrant,$0.06,-0.0051,-7.834%,0.00,United States,2021,23351,,
JUPW,Jupiter Wellness Inc. Common Stock,$0.855,-0.095,-10.00%,18714999.00,United States,2020,100929,Health Care,Biotechnology: Pharmaceutical Preparations
JUPWW,Jupiter Wellness Inc. Warrant,$0.12,-0.0001,-0.083%,0.00,United States,2020,12401,Health Care,Biotechnology: Pharmaceutical Preparations
JVA,Coffee Holding Co. Inc. Common Stock,$2.03,-0.03,-1.456%,11588456.00,United States,2005,26770,Consumer Staples,Specialty Foods
JWAC,Jupiter Wellness Acquisition Corp. Class A Common Stock,$10.19,0.04,0.394%,184999450.00,United States,2022,1480,Industrials,Consumer Electronics/Appliances
JWEL,Jowell Global Ltd. Ordinary Shares,$0.498,-0.0271,-5.161%,15681131.00,China,2021,370861,Consumer Discretionary,Other Consumer Services
JXJT,JX Luxventure Limited Common Stock,$0.88,0.00,0.00%,2280343.00,China,2013,40904,Consumer Staples,Apparel
JYNT,The Joint Corp. Common Stock,$15.10,-0.44,-2.831%,219398153.00,United States,2014,527658,,
JZ,Jianzhi Education Technology Group Company Limited American Depositary Shares,$0.98,-0.03,-2.97%,59343900.00,China,2022,192358,Real Estate,Other Consumer Services
JZXN,Jiuzi Holdings Inc. Ordinary Shares,$0.1202,-0.0022,-1.797%,3090099.00,China,2021,1566052,Consumer Discretionary,Retail-Auto Dealers and Gas Stations
KACL,Kairous Acquisition Corp. Limited Ordinary Shares,$10.34,0.00,0.00%,104911119.00,Malaysia,2022,1,Finance,Business Services
KACLR,Kairous Acquisition Corp. Limited Rights,$0.13,-0.025,-16.129%,0.00,Malaysia,2022,46250,Finance,Business Services
KACLW,Kairous Acquisition Corp. Limited Warrants,$0.08,-0.001,-1.235%,0.00,Malaysia,2022,21590,Finance,Business Services
KAII,Kismet Acquisition Two Corp. Class A Ordinary Shares,$10.06,0.01,0.10%,294255000.00,United States,2021,100300,Finance,Business Services
KAIIU,Kismet Acquisition Two Corp. Unit,$10.02,0.01,0.10%,0.00,United States,2021,800,Finance,Business Services
KAIIW,Kismet Acquisition Two Corp. Warrant,$0.0047,0.0015,46.875%,0.00,United States,2021,51464,Finance,Business Services
KAIR,Kairos Acquisition Corp. Class A Ordinary Shares,$10.07,0.0171,0.17%,347415000.00,United States,2021,236763,Finance,Business Services
KAIRU,Kairos Acquisition Corp. Unit,$10.06,0.00,0.00%,0.00,United States,2021,472,Finance,Business Services
KAIRW,Kairos Acquisition Corp. Warrant,$0.0003,-0.0002,-40.00%,0.00,United States,2021,91910,Finance,Business Services
KAL,Kalera Public Limited Company Ordinary Shares,$0.0831,0.0081,10.80%,7635048.00,Ireland,,12724568,Consumer Staples,Farming/Seeds/Milling
KALA,Kala Pharmaceuticals Inc. Common Stock,$4.22,-0.16,-3.653%,236572630.00,United States,2017,14468,Health Care,Biotechnology: Pharmaceutical Preparations
KALU,Kaiser Aluminum Corporation Common Stock,$76.81,-0.95,-1.222%,1224399406.00,United States,,1462618,Industrials,Aluminum
KALV,KalVista Pharmaceuticals Inc. Common Stock,$5.63,-0.09,-1.573%,138600185.00,United Kingdom,2015,469800,Health Care,Biotechnology: Pharmaceutical Preparations
KALWW,Kalera Public Limited Company Warrant,$0.0162,-0.0027,-14.286%,0.00,Ireland,,105952,Consumer Staples,Farming/Seeds/Milling
KARO,Karooooo Ltd. Ordinary Shares,$22.79,-0.26,-1.128%,705375706.00,Singapore,2021,405,Technology,Computer Software: Prepackaged Software
KAVL,Kaival Brands Innovations Group Inc. Common Stock,$0.8939,-0.0181,-1.985%,50209550.00,United States,,118343,Health Care, Medicinal Chemicals and Botanical Products 
KBAL,Kimball International Inc. Class B Common Stock,$6.40,0.11,1.749%,234070438.00,United States,,559195,Consumer Discretionary,Industrial Specialties
KBNT,Kubient Inc. Common Stock,$0.815,-0.0046,-0.561%,11738038.00,United States,2020,9014,Technology,EDP Services
KBNTW,Kubient Inc. Warrant,$0.1185,0.0185,18.50%,0.00,United States,2020,101,Technology,EDP Services
KC,Kingsoft Cloud Holdings Limited American Depositary Shares,$3.59,-0.02,-0.554%,863605808.00,China,2020,1721370,Technology,Computer Software: Prepackaged Software
KDNY,Chinook Therapeutics Inc. Common Stock,$25.42,0.61,2.459%,1625370560.00,United States,2015,920528,Health Care,Biotechnology: Pharmaceutical Preparations
