Symbol,Name,Last Sale,Net Change,% Change,Market Cap,Country,IPO Year,Volume,Sector,Industry
CSBR,Champions Oncology Inc. Common Stock,$4.90,-0.60,-10.909%,66437385.00,United States,,103136,Health Care,Biotechnology: Biological Products (No Diagnostic Substances)
CSCO,Cisco Systems Inc. Common Stock (DE),$47.81,-0.34,-0.706%,196408407442.00,United States,1990,60386258,Telecommunications,Computer Communications Equipment
CSGP,CoStar Group Inc. Common Stock,$77.98,0.10,0.128%,31713690879.00,United States,1998,18465314,Finance,Real Estate
CSGS,CSG Systems International Inc. Common Stock,$55.26,-0.78,-1.392%,1740990228.00,United States,1996,1184312,Technology,EDP Services
CSII,Cardiovascular Systems Inc. Common Stock,$14.51,0.26,1.825%,607711389.00,United States,1981,1529453,Health Care,Medical/Dental Instruments
CSIQ,Canadian Solar Inc. Common Shares (ON),$34.11,-0.71,-2.039%,2192209484.00,Canada,2006,798796,,
CSLM,Consilium Acquisition Corp I Ltd. Class A Ordinary Share,$10.11,0.00,0.00%,239796563.00,United States,2022,2,Finance,Business Services
CSPI,CSP Inc. Common Stock,$8.94,-0.16,-1.758%,40719805.00,United States,1982,6464,Technology,EDP Services
CSQ,Calamos Strategic Total Return Common Stock,$13.52,-0.21,-1.529%,2134469256.00,United States,2004,247697,Finance,Finance Companies
CSSE,Chicken Soup for the Soul Entertainment Inc. Class A Common Stock,$5.82,-0.18,-3.00%,73616586.00,United States,2017,69529,Consumer Discretionary,Movies/Entertainment
CSSEL,Chicken Soup for the Soul Entertainment Inc. Warrant,$0.0198,0.001,5.319%,0.00,United States,,201649,Consumer Discretionary,Movies/Entertainment
CSSEN,Chicken Soup for the Soul Entertainment Inc. 9.50% Notes due 2025,$25.375,0.075,0.296%,0.00,United States,,1909,Consumer Discretionary,Movies/Entertainment
CSSEP,Chicken Soup for the Soul Entertainment Inc. 9.75% Series A Cumulative Redeemable Perpetual Preferred Stock,$22.75,-0.05,-0.219%,0.00,United States,,8522,Consumer Discretionary,Movies/Entertainment
CSTE,Caesarstone Ltd. Ordinary Shares,$5.75,-0.12,-2.044%,198389249.00,Israel,2012,151633,Industrials,Building Materials
CSTL,Castle Biosciences Inc. Common Stock,$24.07,-0.62,-2.511%,634282434.00,United States,2019,275936,Health Care,Medical Specialities
CSTR,CapStar Financial Holdings Inc. Common Stock,$17.09,-0.01,-0.058%,374523385.00,United States,2016,222911,Finance,Major Banks
CSWC,Capital Southwest Corporation Common Stock,$17.35,-0.03,-0.173%,556145610.00,United States,,1073896,Finance,Finance/Investors Services
CSWI,CSW Industrials Inc. Common Stock,$116.42,2.05,1.792%,1801816740.00,United States,,107616,Industrials,Home Furnishings
CSX,CSX Corporation Common Stock,$31.65,-0.12,-0.378%,66541236273.00,United States,,33872917,Industrials,Railroads
CTAQ,Carney Technology Acquisition Corp. II Class A Common Stock,$10.35,0.06,0.583%,530049375.00,United States,2021,1841,Industrials,Consumer Electronics/Appliances
CTAQU,Carney Technology Acquisition Corp. II Units,$10.45,0.28,2.753%,0.00,United States,2020,1501,Industrials,Consumer Electronics/Appliances
CTAQW,Carney Technology Acquisition Corp. II Warrant,$0.0601,-0.0024,-3.84%,0.00,United States,2021,209814,Industrials,Consumer Electronics/Appliances
CTAS,Cintas Corporation Common Stock,$445.28,0.77,0.173%,45216101425.00,United States,1983,854823,Consumer Discretionary,Business Services
CTBI,Community Trust Bancorp Inc. Common Stock,$44.80,-0.60,-1.322%,802738944.00,United States,,163257,Finance,Major Banks
CTG,Computer Task Group Inc. Common Stock,$7.22,0.33,4.79%,113443896.00,United States,,21165,Technology,EDP Services
CTHR,Charles & Colvard Ltd Common Stock,$0.8281,-0.0062,-0.743%,25128657.00,United States,1997,122021,Consumer Discretionary,Consumer Specialties
CTIB,Yunhong CTI Ltd. Common Stock,$1.05,0.00,0.00%,16862046.00,United States,1997,216102,Miscellaneous,Diversified Commercial Services
CTIC,CTI BioPharma Corp. (DE) Common Stock,$5.71,0.01,0.175%,724565899.00,United States,1997,3797654,Health Care,Biotechnology: Pharmaceutical Preparations
CTKB,Cytek Biosciences Inc. Common Stock,$10.49,-0.30,-2.78%,1414611736.00,United States,2021,810139,Health Care,Biotechnology: Electromedical & Electrotherapeutic Apparatus
CTLP,Cantaloupe Inc. Common Stock,$4.07,0.06,1.496%,294908334.00,United States,,567658,Technology,EDP Services
CTMX,CytomX Therapeutics Inc. Common Stock,$1.57,-0.02,-1.258%,103752456.00,United States,2015,1306580,Health Care,Biotechnology: Pharmaceutical Preparations
CTRM,Castor Maritime Inc. Common Shares,$1.15,-0.03,-2.542%,108801601.00,Cyprus,,666105,Consumer Discretionary,Marine Transportation
CTRN,Citi Trends Inc. Common Stock,$27.54,-0.71,-2.513%,230131235.00,United States,2005,225373,,
CTSH,Cognizant Technology Solutions Corporation Class A Common Stock,$55.56,-0.79,-1.402%,28553474762.00,United States,1998,8719955,Technology,EDP Services
CTSO,Cytosorbents Corporation Common Stock,$1.19,0.03,2.586%,51926501.00,United States,,97151,Health Care,Medical/Dental Instruments
CTXR,Citius Pharmaceuticals Inc. Common Stock,$1.12,-0.01,-0.885%,163665186.00,United States,,390334,Health Care,Biotechnology: Pharmaceutical Preparations
CUBA,Herzfeld Caribbean Basin Fund Inc. (The) Common Stock,$3.85,-0.055,-1.408%,24752636.00,United States,,25687,Finance,Investment Managers
CUE,Cue Biopharma Inc. Common Stock,$2.70,-0.13,-4.594%,116214880.00,United States,2018,127857,Health Care,Biotechnology: Pharmaceutical Preparations
CUEN,Cuentas Inc. Common Stock,$0.2595,0.0224,9.447%,5005686.00,United States,,173302,Technology,Computer Software: Prepackaged Software
CUENW,Cuentas Inc. Warrant,$0.05,-0.0149,-22.958%,0.00,United States,,1500,Technology,Computer Software: Prepackaged Software
CULL,Cullman Bancorp Inc. Common Stock,$11.39,0.09,0.796%,84353121.00,United States,2021,578,Finance,Savings Institutions
CURI,CuriosityStream Inc. Class A Common Stock,$1.20,-0.01,-0.826%,63367338.00,United States,2020,288267,Industrials,Broadcasting
CURIW,CuriosityStream Inc. Warrant,$0.0978,-0.0508,-34.186%,0.00,United States,2020,1350,Industrials,Broadcasting
CUTR,Cutera Inc. Common Stock,$45.57,-0.39,-0.849%,893877332.00,United States,2004,416863,Health Care,Biotechnology: Electromedical & Electrotherapeutic Apparatus
CVAC,CureVac N.V. Ordinary Shares,$6.81,0.04,0.591%,1295828837.00,Germany,2020,1065463,Health Care,Biotechnology: Pharmaceutical Preparations
CVBF,CVB Financial Corporation Common Stock,$25.53,-0.26,-1.008%,3569298266.00,United States,,6065776,Finance,Major Banks
CVCO,Cavco Industries Inc. Common Stock When Issued,$228.38,-2.03,-0.881%,2034714841.00,United States,,308448,Consumer Discretionary,Homebuilding
CVCY,Central Valley Community Bancorp Common Stock,$20.32,-0.10,-0.49%,238394464.00,United States,,28578,Finance,Major Banks
CVGI,Commercial Vehicle Group Inc. Common Stock,$6.73,0.00,0.00%,224606899.00,United States,2004,56346,Consumer Discretionary,Auto Parts:O.E.M.
CVGW,Calavo Growers Inc. Common Stock,$32.95,-0.72,-2.138%,584258230.00,United States,,447639,Consumer Discretionary,Specialty Foods
CVLG,Covenant Logistics Group Inc. Class A Common Stock,$36.95,-0.28,-0.752%,498614016.00,United States,,239301,Industrials,Trucking Freight/Courier Services
CVLT,Commvault Systems Inc. Common Stock,$63.23,0.04,0.063%,2815760763.00,United States,2006,416440,Technology,Computer Software: Prepackaged Software
CVLY,Codorus Valley Bancorp Inc Common Stock,$22.87,-0.11,-0.479%,218513816.00,United States,,17295,Finance,Savings Institutions
CVRX,CVRx Inc. Common Stock,$15.47,0.54,3.617%,318437002.00,United States,2021,48585,Health Care,Biotechnology: Electromedical & Electrotherapeutic Apparatus
CVT,Cvent Holding Corp. Common Stock,$5.41,-0.07,-1.277%,2621940660.00,United States,1987,1944418,Technology,Computer Software: Prepackaged Software
CVV,CVD Equipment Corporation Common Stock,$5.77,0.1656,2.955%,39010612.00,United States,,3390,Technology,Industrial Machinery/Components
CWBC,Community West Bancshares Common Stock,$14.64,0.08,0.549%,128242930.00,United States,,1358,Finance,Major Banks
CWBR,CohBar Inc. Common Stock,$1.81,-0.12,-6.218%,5261536.00,United States,,46137,Health Care,Biotechnology: In Vitro & In Vivo Diagnostic Substances
CWCO,Consolidated Water Co. Ltd. Ordinary Shares,$14.67,-0.51,-3.36%,224335224.00,Cayman Islands,,275757,Utilities,Water Supply
CWST,Casella Waste Systems Inc. Class A Common Stock,$81.44,-0.24,-0.294%,4208839804.00,United States,1997,323964,Utilities,Environmental Services
CXDO,Crexendo Inc. Common Stock,$1.80,-0.18,-9.091%,45391869.00,United States,,78342,Consumer Discretionary,Telecommunications Equipment
CYAD,Celyad Oncology SA American Depositary Shares,$0.99,-0.04,-3.883%,22368016.00,Belgium,2015,2819,Health Care,Biotechnology: Pharmaceutical Preparations
CYAN,Cyanotech Corporation Common Stock,$1.04,0.0502,5.072%,6522850.00,United States,,21893,Consumer Staples,Farming/Seeds/Milling
CYBR,CyberArk Software Ltd. Ordinary Shares,$131.95,-1.33,-0.998%,5372519612.00,Israel,2014,744616,Technology,Computer Software: Prepackaged Software
CYCC,Cyclacel Pharmaceuticals Inc. Common Stock,$0.7638,-0.0052,-0.676%,9577433.00,United States,,143145,Health Care,Biotechnology: Pharmaceutical Preparations
CYCCP,Cyclacel Pharmaceuticals Inc. 6% Convertible Preferred Stock,$9.99,0.00,0.00%,0.00,United States,,2,Health Care,Biotechnology: Pharmaceutical Preparations
CYCN,Cyclerion Therapeutics Inc. Common Stock,$0.6739,0.0528,8.501%,29310731.00,United States,,273542,Health Care,Biotechnology: Pharmaceutical Preparations
CYN,Cyngn Inc. Common Stock,$0.73,0.0405,5.874%,24586977.00,United States,2021,91822,Technology,EDP Services
CYRN,CYREN Ltd. Ordinary Shares,$0.7001,0.0113,1.641%,5600666.00,United States,,23278,Technology,Computer Software: Prepackaged Software
CYRX,CryoPort Inc. Common Stock,$17.72,0.04,0.226%,868277147.00,United States,,634695,,
CYT,Cyteir Therapeutics Inc. Common Stock,$1.23,-0.10,-7.519%,43589862.00,United States,2021,232821,Health Care,Biotechnology: Pharmaceutical Preparations
CYTH,Cyclo Therapeutics Inc. Common Stock,$1.81,0.00,0.00%,15352145.00,United States,,49368,Health Care,Biotechnology: Pharmaceutical Preparations
CYTHW,Cyclo Therapeutics Inc. Warrant,$0.61,0.00,0.00%,0.00,United States,,100,Health Care,Biotechnology: Pharmaceutical Preparations
CYTK,Cytokinetics Incorporated Common Stock,$43.71,0.61,1.415%,4136321054.00,United States,2004,3054160,Health Care,Biotechnology: Pharmaceutical Preparations
CYTO,Altamira Therapeutics Ltd. 0.2 Common Shares (Bermuda),$4.66,-0.44,-8.627%,5008163.00,Bermuda,2014,29925,Health Care,Biotechnology: Pharmaceutical Preparations
CYXT,Cyxtera Technologies Inc. Class A Common Stock,$1.97,0.06,3.141%,353846489.00,United States,2020,904691,Technology,EDP Services
CZFS,Citizens Financial Services Inc. Common Stock,$76.33,0.43,0.567%,303122612.00,United States,,6743,Finance,Major Banks
CZNC,Citizens & Northern Corp Common Stock,$24.12,0.79,3.386%,373870034.00,United States,,118844,Finance,Major Banks
CZR,Caesars Entertainment Inc. Common Stock,$47.26,-1.02,-2.113%,10140394122.00,United States,,3616756,Consumer Discretionary,Hotels/Resorts
CZWI,Citizens Community Bancorp Inc. Common Stock,$11.61,-0.21,-1.777%,121714712.00,United States,2006,104780,Finance,Savings Institutions
DADA,Dada Nexus Limited American Depositary Shares,$7.86,0.23,3.014%,2008930365.00,China,2020,1635903,Consumer Discretionary,Department/Specialty Retail Stores
DAIO,Data I/O Corporation Common Stock,$3.80,0.03,0.796%,33502248.00,United States,1981,29064,Technology,Industrial Machinery/Components
DAKT,Daktronics Inc. Common Stock,$2.54,0.11,4.527%,115482949.00,United States,1994,561446,Industrials,Office Equipment/Supplies/Services
DALN,DallasNews Corporation Series A Common Stock,$3.95,-0.169,-4.103%,21142336.00,United States,,27301,Consumer Discretionary,Newspapers/Magazines
DALS,DA32 Life Science Tech Acquisition Corp. Class A Common Stock,$9.8901,0.00,0.00%,253681065.00,United States,2021,2,Industrials,Consumer Electronics/Appliances
DAOO,Crypto 1 Acquisition Corp Class A Ordinary Shares,$10.15,0.015,0.148%,291812500.00,United States,2022,31125,Finance,Business Services
DAOOU,Crypto 1 Acquisition Corp Unit,$10.13,-0.01,-0.099%,0.00,United States,2021,151,Finance,Business Services
DAOOW,Crypto 1 Acquisition Corp Warrants,$0.0008,-0.0006,-42.857%,0.00,United States,2022,33889,Finance,Business Services
DARE,Dare Bioscience Inc. Common Stock,$0.89,-0.014,-1.549%,75472000.00,United States,2014,202685,Health Care,Biotechnology: Pharmaceutical Preparations
DATS,DatChat Inc. Common Stock,$0.4235,0.0035,0.833%,8723007.00,United States,2021,46069,Technology,Computer Software: Prepackaged Software
DATSW,DatChat Inc. Series A Warrant,$0.0776,0.00,0.00%,0.00,United States,2021,105,Technology,Computer Software: Prepackaged Software
DAVE,Dave Inc. Class A Common Stock,$0.284,-0.006,-2.069%,107382342.00,United States,,1318802,Technology,Retail: Computer Software & Peripheral Equipment
DAVEW,Dave Inc. Warrants,$0.0347,-0.0018,-4.932%,0.00,United States,,7068,Technology,Retail: Computer Software & Peripheral Equipment
DAWN,Day One Biopharmaceuticals Inc. Common Stock,$21.42,0.00,0.00%,1575430847.00,United States,2021,878547,Health Care,Biotechnology: Pharmaceutical Preparations
DBGI,Digital Brands Group Inc. Common Stock,$3.85,-0.20,-4.938%,5880825.00,United States,2021,1137923,Consumer Discretionary,Apparel
DBGIW,Digital Brands Group Inc. Warrant,$1.95,0.07,3.723%,0.00,United States,2021,1006,Consumer Discretionary,Apparel
DBTX,Decibel Therapeutics Inc. Common Stock,$2.17,-0.23,-9.583%,54172969.00,United States,2021,169123,Health Care,Biotechnology: Pharmaceutical Preparations
DBVT,DBV Technologies S.A. American Depositary Shares,$1.20,-0.21,-14.894%,225520538.00,France,2014,220210,Health Care,Biotechnology: Pharmaceutical Preparations
DBX,Dropbox Inc. Class A Common Stock,$23.20,0.05,0.216%,8415483970.00,United States,2018,5782880,Technology,Computer Software: Prepackaged Software
DCBO,Docebo Inc. Common Shares,$33.75,-0.25,-0.735%,1110593160.00,Canada,,196602,,
DCFC,Tritium DCFC Limited Ordinary Shares,$1.36,0.04,3.03%,208427326.00,Australia,,1597140,Technology,Electronic Components
DCFCW,Tritium DCFC Limited Warrant,$0.27,-0.0098,-3.503%,0.00,Australia,,101491,Technology,Electronic Components
DCGO,DocGo Inc. Common Stock,$6.94,0.01,0.144%,713617097.00,United States,2020,1765051,Health Care,Managed Health Care
DCOM,Dime Community Bancshares Inc. Common Stock,$31.28,-0.44,-1.387%,1206584304.00,United States,,899233,Finance,Savings Institutions
DCOMP,Dime Community Bancshares Inc. Fixed-Rate Non-Cumulative Perpetual Preferred Stock Series A,$19.12,-0.10,-0.52%,0.00,United States,,14693,Finance,Savings Institutions
DCPH,Deciphera Pharmaceuticals Inc. Common Stock,$15.31,-0.39,-2.484%,1034589341.00,United States,2017,803640,Health Care,Biotechnology: Pharmaceutical Preparations
DCRD,Decarbonization Plus Acquisition Corporation IV Class A Ordinary Share,$10.18,-0.01,-0.098%,402428125.00,United States,2021,25786,Finance,Business Services
DCRDU,Decarbonization Plus Acquisition Corporation IV Unit,$10.365,-0.075,-0.718%,0.00,United States,2021,200,Finance,Business Services
DCRDW,Decarbonization Plus Acquisition Corporation IV Warrant,$0.52,-0.03,-5.455%,0.00,United States,2021,28349,Finance,Business Services
DCT,Duck Creek Technologies Inc. Common Stock,$11.76,0.01,0.085%,1561022612.00,United States,2020,776920,Technology,Retail: Computer Software & Peripheral Equipment
DCTH,Delcath Systems Inc. Common Stock,$3.71,0.15,4.213%,37272778.00,United States,,34626,Health Care,Medical Specialities
DDI,DoubleDown Interactive Co. Ltd. American Depository Shares,$9.49,0.50,5.562%,470262146.00,South Korea,2021,2238,Technology,EDP Services
DDOG,Datadog Inc. Class A Common Stock,$77.83,-0.475,-0.607%,24715682192.00,United States,2019,4461930,Technology,EDP Services
DECA,Denali Capital Acquisition Corp. Class A Ordinary Shares,$10.24,-0.02,-0.195%,110822400.00,United States,2022,3877,Finance,Business Services
DECAU,Denali Capital Acquisition Corp. Unit,$10.23,-0.03,-0.292%,0.00,United States,2022,100,Finance,Business Services
DENN,Denny's Corporation Common Stock,$9.98,-0.21,-2.061%,571188075.00,United States,,873754,Consumer Discretionary,Restaurants
DERM,Journey Medical Corporation Common Stock,$1.40,-0.07,-4.762%,24786055.00,United States,2021,5122,Health Care,Biotechnology: Pharmaceutical Preparations
DFFN,Diffusion Pharmaceuticals Inc. Common Stock,$6.18,0.12,1.98%,12603752.00,United States,,5766,Health Care,Biotechnology: Pharmaceutical Preparations
DFLI,Dragonfly Energy Holdings Corp. Common Stock,$16.31,3.18,24.219%,705778194.00,United States,2021,368016,Technology,Electronic Components
DFLIW,Dragonfly Energy Holdings Corp. Warrant,$0.50,0.00,0.00%,0.00,United States,2021,137373,Technology,Electronic Components
DGHI,Digihost Technology Inc. Common Subordinate Voting Shares,$0.5134,-0.0065,-1.25%,14284232.00,Canada,,55970,,
DGICA,Donegal Group Inc. Class A Common Stock,$13.95,0.33,2.423%,452929660.00,United States,,143427,Finance,Property-Casualty Insurers
DGICB,Donegal Group Inc. Class B Common Stock,$18.48,-1.26,-6.383%,600010044.00,United States,1986,16913,Finance,Property-Casualty Insurers
DGII,Digi International Inc. Common Stock,$37.44,-1.72,-4.392%,1335355744.00,United States,1989,1248211,Technology,Computer peripheral equipment
DGLY,Digital Ally Inc. Common Stock,$0.25,-0.008,-3.101%,13475851.00,United States,,142745,Technology,Security Systems Services
DGNU,Dragoneer Growth Opportunities Corp. III Class A Ordinary Shares,$9.85,0.00,0.00%,530269904.00,United States,2021,487597,Finance,Business Services
DH,Definitive Healthcare Corp. Class A Common Stock,$11.70,-0.24,-2.01%,1229436725.00,United States,2021,1128174,Technology,Computer Software: Prepackaged Software
DHAC,Digital Health Acquisition Corp. Common Stock,$10.66,0.00,0.00%,43984471.00,United States,2021,1,Industrials,Consumer Electronics/Appliances
DHACU,Digital Health Acquisition Corp. Unit,$11.01,-0.20,-1.784%,0.00,United States,2021,300,Industrials,Consumer Electronics/Appliances
DHACW,Digital Health Acquisition Corp. Warrant,$0.105,0.00,0.00%,0.00,United States,2021,2495,Industrials,Consumer Electronics/Appliances
DHC,Diversified Healthcare Trust Common Shares of Beneficial Interest,$0.7104,-0.026,-3.531%,170285480.00,United States,,52810632,Real Estate,Real Estate Investment Trusts
DHCA,DHC Acquisition Corp. Class A ordinary share,$10.05,-0.02,-0.199%,388747467.00,United States,2021,8773,Finance,Business Services
DHCAW,DHC Acquisition Corp. Warrant,$0.0089,0.00,0.00%,0.00,United States,2021,1,Finance,Business Services
DHCNI,Diversified Healthcare Trust 5.625% Senior Notes due 2042,$11.05,-0.02,-0.181%,0.00,United States,,8284,Real Estate,Real Estate Investment Trusts
DHCNL,Diversified Healthcare Trust 6.25% Senior Notes Due 2046,$12.04,0.04,0.333%,0.00,United States,,10633,Real Estate,Real Estate Investment Trusts
DHHC,DiamondHead Holdings Corp. Class A Common Stock,$10.03,-0.015,-0.149%,432543750.00,United States,2021,255693,Industrials,Consumer Electronics/Appliances
DHHCU,DiamondHead Holdings Corp. Unit,$10.07,0.01,0.099%,0.00,United States,2021,200,Industrials,Consumer Electronics/Appliances
DHHCW,DiamondHead Holdings Corp. Warrant,$0.2078,0.0078,3.90%,0.00,United States,2021,25600,Industrials,Consumer Electronics/Appliances
DHIL,Diamond Hill Investment Group Inc. Class A Common Stock,$182.46,0.16,0.088%,550272903.00,United States,,33560,Finance,Investment Managers
DIBS,1stdibs.com Inc. Common Stock,$5.07,-0.08,-1.553%,197378999.00,United States,2021,312988,Miscellaneous,Diversified Commercial Services
DICE,DICE Therapeutics Inc. Common Stock,$32.63,-1.22,-3.604%,1555239774.00,United States,2021,1991379,Health Care,Biotechnology: Pharmaceutical Preparations
DILA,DILA Capital Acquisition Corp. Class A Common Stock,$10.035,0.005,0.05%,76060032.00,Mexico,2021,3209,Industrials,Consumer Electronics/Appliances
DILAW,DILA Capital Acquisition Corp. Warrant,$0.0001,0.00,0.00%,0.00,Mexico,2021,4000,Industrials,Consumer Electronics/Appliances
DIOD,Diodes Incorporated Common Stock,$80.52,-1.50,-1.829%,3661221291.00,United States,,663998,Technology,Semiconductors
DISA,Disruptive Acquisition Corporation I Class A Ordinary Shares,$10.05,0.00,0.00%,345468750.00,United States,2021,12593,Finance,Business Services
DISAU,Disruptive Acquisition Corporation I Unit,$10.05,-0.01,-0.099%,0.00,United States,2021,100,Finance,Business Services
DISAW,Disruptive Acquisition Corporation I Warrant,$0.0277,-0.0024,-7.973%,0.00,United States,2021,60757,Finance,Business Services
DISH,DISH Network Corporation Class A Common Stock,$14.41,-0.45,-3.028%,7647480247.00,United States,1995,20858427,Consumer Discretionary,Telecommunications Equipment
DJCO,Daily Journal Corp. (S.C.) Common Stock,$275.37,-0.03,-0.011%,379191650.00,United States,,10122,Technology,Retail: Computer Software & Peripheral Equipment
DKDCA,Data Knights Acquisition Corp. Class A Common Stock,$10.44,0.00,0.00%,156184227.00,United Kingdom,2021,8512,Industrials,Consumer Electronics/Appliances
DKDCW,Data Knights Acquisition Corp. Warrant,$0.04,-0.0075,-15.789%,0.00,United Kingdom,2021,155,Industrials,Consumer Electronics/Appliances
DKNG,DraftKings Inc. Class A Common Stock,$12.12,-0.51,-4.038%,5440040608.00,United States,2019,18485333,Consumer Discretionary,Services-Misc. Amusement & Recreation
DLCA,Deep Lake Capital Acquisition Corp. Class A Ordinary Shares,$10.075,0.00,0.00%,260690625.00,United States,2021,22,Finance,Business Services
DLCAU,Deep Lake Capital Acquisition Corp. Unit,$10.06,0.00,0.00%,0.00,United States,2021,50,Finance,Business Services
DLCAW,Deep Lake Capital Acquisition Corp. Warrant,$0.0035,-0.0015,-30.00%,0.00,United States,2021,49901,Finance,Business Services
DLHC,DLH Holdings Corp.,$12.91,0.10,0.781%,168440372.00,United States,,22917,Consumer Discretionary,Business Services
DLO,DLocal Limited Class A Common Shares,$13.55,0.24,1.803%,4010597983.00,Uruguay,2021,1788631,Consumer Discretionary,Business Services
DLPN,Dolphin Entertainment Inc. Common Stock,$1.95,-0.15,-7.143%,19917401.00,United States,,32075,Consumer Discretionary,Advertising
DLTH,Duluth Holdings Inc. Class B Common Stock,$6.11,0.06,0.992%,204212728.00,United States,2015,161925,Consumer Discretionary,Department/Specialty Retail Stores
DLTR,Dollar Tree Inc. Common Stock,$142.65,-2.46,-1.695%,31551965929.00,United States,1995,3586303,Consumer Discretionary,Department/Specialty Retail Stores
DMAC,DiaMedica Therapeutics Inc. Common Stock,$1.53,0.02,1.325%,40457893.00,United States,2018,47345,Health Care,Pharmaceuticals and Biotechnology
DMAQ,Deep Medicine Acquisition Corp. Class A Common Stock,$10.19,-0.05,-0.488%,167454308.00,United States,2021,9200,Industrials,Consumer Electronics/Appliances
DMAQR,Deep Medicine Acquisition Corp. Rights,$0.0875,0.00,0.00%,0.00,United States,2021,2,,
DMLP,Dorchester Minerals L.P. Common Units Representing Limited Partnership Interests,$27.60,-0.54,-1.919%,1059053207.00,United States,,130320,Energy,Oil & Gas Production
DMRC,Digimarc Corporation Common Stock,$19.86,-0.73,-3.545%,397914066.00,United States,,147577,Technology,EDP Services
DMTK,DermTech Inc. Common Stock,$2.05,-0.07,-3.302%,61940145.00,United States,2017,253720,Health Care,Managed Health Care
DNAB,Social Capital Suvretta Holdings Corp. II Class A Ordinary Shares,$10.00,-0.015,-0.15%,318900000.00,United States,2021,60472,Finance,Business Services
DNAD,Social Capital Suvretta Holdings Corp. IV Class A Ordinary Shares,$10.02,0.00,0.00%,319537800.00,United States,2021,70,Finance,Business Services
DNAY,Codex DNA Inc. Common Stock,$1.21,0.01,0.833%,35721326.00,United States,2021,206218,Health Care,Medical Specialities
DNLI,Denali Therapeutics Inc. Common Stock,$28.69,-0.34,-1.171%,3896494135.00,United States,2017,2205149,Health Care,Biotechnology: Biological Products (No Diagnostic Substances)
DNUT,Krispy Kreme Inc. Common Stock,$11.74,-1.56,-11.729%,1965711824.00,United States,2021,4283926,Consumer Discretionary,Specialty Foods
DOCU,DocuSign Inc. Common Stock,$56.27,-0.04,-0.071%,11314442308.00,United States,2018,13705923,Technology,EDP Services
DOGZ,Dogness (International) Corporation Class A Common Stock,$1.21,0.095,8.52%,47521853.00,China,2017,728675,Consumer Discretionary,Miscellaneous manufacturing industries
DOMO,Domo Inc. Class B Common Stock,$16.55,0.54,3.373%,571719187.00,United States,2018,2177320,Technology,Computer Software: Prepackaged Software
DOOO,BRP Inc. (Recreational Products) Common Subordinate Voting Shares,$75.84,-1.54,-1.99%,5972056217.00,Canada,,32616,,
DORM,Dorman Products Inc. Common Stock,$80.55,-2.35,-2.835%,2530766216.00,United States,,565914,Consumer Discretionary,Auto Parts:O.E.M.
DOX,Amdocs Limited Ordinary Shares,$87.47,-0.46,-0.523%,10567828177.00,Guernsey,,1015617,Technology,EDP Services
DOYU,DouYu International Holdings Limited ADS,$1.26,0.08,6.78%,400029638.00,China,2019,3517674,Technology,Computer Software: Programming Data Processing
DPCS,DP Cap Acquisition Corp I Class A Ordinary Shares,$10.24,0.00,0.00%,294400000.00,United States,2021,48420,Finance,Business Services
DPRO,Draganfly Inc. Common Shares,$1.01,0.03,3.061%,34139546.00,Canada,,159568,Consumer Discretionary,Electronic Components
DRAY,Macondray Capital Acquisition Corp. I Class A Ordinary Shares,$10.14,-0.01,-0.099%,364406250.00,United States,2021,40343,Finance,Business Services
DRAYW,Macondray Capital Acquisition Corp. I Warrant,$0.0693,0.0478,222.326%,0.00,United States,2021,420,Finance,Business Services
DRCT,Direct Digital Holdings Inc. Class A Common Stock,$2.60,-0.13,-4.762%,36862800.00,United States,2022,30537,Consumer Discretionary,Advertising
